[
  { "id": "h_0001", "situation": "BID_WON", "template": "{academy}, {teacher} 영입에 성공", "tone": "GOOD", "weight": 10 },
  { "id": "h_0002", "situation": "BID_LOST", "template": "{teacher} 영입전, 아쉽게 막 내려", "tone": "BAD", "weight": 10 },
  { "id": "h_0003", "situation": "BID_STOLEN", "template": "{rival}, {teacher} 영입을 가로채", "tone": "BAD", "weight": 10 },
  { "id": "h_0004", "situation": "NO_BID", "template": "{academy}, 이번 시장은 관망 선택", "tone": "NEUTRAL", "weight": 10 },
  { "id": "h_0005", "situation": "TOP_CLASS_SURGE", "template": "{academy} 상위반 성적 가파른 상승", "tone": "GOOD", "weight": 10 },
  { "id": "h_0006", "situation": "TOP_CLASS_EMPTY_SLOT", "template": "{academy} 상위반 강사 {n}자리 공석", "tone": "BAD", "weight": 10 },
  { "id": "h_0007", "situation": "REPUTATION_UP", "template": "{academy} 평판 {n}계단 상승", "tone": "GOOD", "weight": 10 },
  { "id": "h_0008", "situation": "REPUTATION_DOWN", "template": "{academy} 평판 {n}계단 하락", "tone": "BAD", "weight": 10 },
  { "id": "h_0009", "situation": "CASH_CRISIS", "template": "{academy}, 남은 자금 {n} 비상", "tone": "BAD", "weight": 10 },
  { "id": "h_0010", "situation": "SHARE_TAKEOVER", "template": "{academy}, {rival} 제치고 점유율 {n}%", "tone": "GOOD", "weight": 10 },
  { "id": "h_0011", "situation": "SHARE_LOST", "template": "{academy}, {rival}에 밀려 점유율 {n}%", "tone": "BAD", "weight": 10 },
  { "id": "h_0012", "situation": "TUITION_RAISED", "template": "{academy} 수강료 인상에 반응 엇갈려", "tone": "BAD", "weight": 10 },
  { "id": "h_0013", "situation": "SCHOLARSHIP_EXPANDED", "template": "{academy} 장학 확대에 문의 늘어", "tone": "GOOD", "weight": 10 },
  { "id": "h_0014", "situation": "BID_WON", "template": "{subject} {teacher}, {n}에 새 둥지", "tone": "GOOD", "weight": 8 },
  { "id": "h_0015", "situation": "BID_LOST", "template": "{academy}, {subject} {teacher} 영입 불발", "tone": "BAD", "weight": 8 },
  { "id": "h_0016", "situation": "BID_STOLEN", "template": "{rival}, {subject} {teacher} 품어", "tone": "BAD", "weight": 8 },
  { "id": "h_0017", "situation": "NO_BID", "template": "무입찰 택한 {academy}, 다음 기회 주시", "tone": "NEUTRAL", "weight": 8 },
  { "id": "h_0018", "situation": "TOP_CLASS_SURGE", "template": "{academy} 상위반 성적 반등 뚜렷", "tone": "GOOD", "weight": 8 },
  { "id": "h_0019", "situation": "TOP_CLASS_EMPTY_SLOT", "template": "상위반 강사 자리 {n}칸 공석", "tone": "BAD", "weight": 8 },
  { "id": "h_0020", "situation": "CASH_CRISIS", "template": "잔액 {n}, {academy} 긴축 신호", "tone": "BAD", "weight": 8 },
  { "id": "h_0021", "situation": "REPUTATION_UP", "template": "{academy}, 신뢰 회복에 평판 {n} 상승", "tone": "GOOD", "weight": 9 },
  { "id": "h_0022", "situation": "REPUTATION_DOWN", "template": "평판 {n} 하락, {academy} 대응 고심", "tone": "BAD", "weight": 9 },
  { "id": "h_0023", "situation": "SHARE_TAKEOVER", "template": "{academy} 점유율 {n}%, {rival} 추월", "tone": "GOOD", "weight": 9 },
  { "id": "h_0024", "situation": "SHARE_LOST", "template": "{rival} 선두, {academy} 점유율 {n}%", "tone": "BAD", "weight": 9 },
  { "id": "h_0025", "situation": "TUITION_RAISED", "template": "수강료 올린 {academy}, 문의 흐름 주춤", "tone": "BAD", "weight": 9 },
  { "id": "h_0026", "situation": "SCHOLARSHIP_EXPANDED", "template": "장학 폭 넓힌 {academy}, 관심 집중", "tone": "GOOD", "weight": 9 },
  { "id": "h_0027", "situation": "NO_BID", "template": "{academy}, 영입 대신 내실 다지기", "tone": "NEUTRAL", "weight": 7 },
  { "id": "h_0028", "situation": "BID_WON", "template": "{teacher} 합류, {academy} {subject} 강화", "tone": "GOOD", "weight": 7 },
  { "id": "h_0029", "situation": "TOP_CLASS_SURGE", "template": "상위반 성적 뛰자 {academy} 분위기 반전", "tone": "GOOD", "weight": 7 },
  { "id": "h_0030", "situation": "CASH_CRISIS", "template": "{academy} 자금 {n}, 지출 경계령", "tone": "BAD", "weight": 7 }
]
